"CountryCode","Period","ProductCode","TradeValue","Quantity","QuantityUnit","ProductDescription"
"LBN",2014,6253,269.476,281,"Item","Tyres, pneumatic, new, of a kind us"
"LBN",2014,8456,268.975,25461,"Item","Swimwear"
"LBN",2014,5236,266.866,89117,"Kg","Phosphinates (hypophosphites), phos"
"LBN",2014,6422,264.211,97159,"Kg","Envelopes, letter cards, plain post"
"LBN",2014,7755,259.198,NA,"N.Q.","Vacuum cleaners"
"LBN",2014,8741,258.963,NA,"N.Q.","Compasses; other navigational instr"
"LBN",2014,6764,256.159,169901,"Kg","Other bars and rods of iron and ste"
"LBN",2014,251,255.976,46455,"Kg","Birds' eggs, in shell, fresh, prese"
"LBN",2014,5986,254.899,2241,"Kg","Organic chemical products, n.e.s."
"LBN",2014,341,252.449,35224,"Kg","Fish, fresh (live or dead) or chill"
"LBN",2014,2927,251.948,39196,"Kg","Cut flowers and foliage"
"LBN",2014,8944,250.779,32197,"Kg","Festive, carnival or other entertai"
"LBN",2014,19,249.376,NA,"N.Q.","Live animals, n.e.s."
"LBN",2014,6539,244.829,4033,"Kg","Pile fabrics and chenille fabrics, "
"LBN",2014,8743,242.28,NA,"N.Q.","Instruments and apparatus for measu"
"LBN",2014,8724,240.584,11251,"Kg","Medical, dental, surgical/veterinar"
"LBN",2014,6529,239.653,4287,"Kg","Other woven fabrics of cotton"
"LBN",2014,8484,238.61,NA,"N.Q.","Headgear and fittings therefor, n.e"
"LBN",2014,7189,236.794,NA,"N.Q.","Engines and motors, n.e.s. (e.g., w"
"LBN",2014,6931,231.692,171652,"Kg","Stranded wire, ropes, cables, plait"
"LBN",2014,7233,231.567,NA,"N.Q.","Moving, grading, levelling, scrapin"
"LBN",2014,2485,228.116,137746,"Kg","Wood of non-coniferous species (inc"
"LBN",2014,6935,226.266,134190,"Kg","Cloth (including endless bands), gr"
"LBN",2014,8482,224.772,32918,"Kg","Articles of apparel and clothing ac"
"LBN",2014,6631,224.713,207323,"Kg","Millstones, grindstones, grinding w"
"LBN",2014,7439,222.456,10386,"Kg","Parts of the machines and apparatus"
"LBN",2014,6825,221.343,25438,"Kg","Copper plates, sheets and strip, of"
"LBN",2014,566,220.921,183264,"Kg","Vegetables prepared or preserved ot"
"LBN",2014,5514,220.173,29748,"Kg","Mixtures of odoriferous substances "
"LBN",2014,8723,217.346,12456,"Kg","Mechanotherapy appliances; massage "
"LBN",2014,723,216.132,43401,"Kg","Cocoa paste, whether or not defatte"
"LBN",2014,7132,215.365,NA,"N.Q.","Internal combustion piston engines "
"LBN",2014,7426,210.021,NA,"N.Q.","Centrifugal pumps, n.e.s."
"LBN",2014,6744,209.322,218355,"Kg","Flat-rolled products of iron or non"
"LBN",2014,6213,208.592,60767,"Kg","Vulcanized rubber thread and cord; "
"LBN",2014,6863,208.472,14425,"Kg","Zinc and zinc alloys, worked"
"LBN",2014,7219,207.791,NA,"N.Q.","Agricultural, horticultural, forest"
"LBN",2014,2665,207.638,143429,"Kg","Synthetic staple fibres, not carded"
"LBN",2014,8913,206.751,392,"Item","Non-military arms"
"LBN",2014,3330,203.807,104969,"Kg","Crude petroleum"
"LBN",2014,4211,203.24,172170,"Kg","Soya bean oil and its fractions"
"LBN",2014,5729,202.186,115066,"Kg","Other styrene polymers"
"LBN",2014,5534,198.895,40914,"Kg","Preparations for oral/dental hygien"
"LBN",2014,8519,198.498,42839,"Kg","Parts of footwear (including uppers"
"LBN",2014,6643,195.758,NA,"N.Q.","Drawn glass and blown glass, in she"
"LBN",2014,819,195.012,255405,"Kg","Food wastes and prepared animal fee"
"LBN",2014,7314,194.521,NA,"N.Q.","Way-type unit head machines; other "
"LBN",2014,6572,193.252,71101,"Kg","Non-wovens, whether/not impregnated"
"LBN",2014,7161,191.547,NA,"N.Q.","Electric motors of an output not > "
"LBN",2014,5751,189.154,129885,"Kg","Polymers of propylene or of other o"
"LBN",2014,8946,187.672,172455,"Kg","Roundabouts, swings, shooting galle"
"LBN",2014,6214,183.167,48319,"Kg","Tubes, pipes and hoses, of unharden"
"LBN",2014,8747,181.038,NA,"N.Q.","Oscilloscopes, spectrum analyzers a"
"LBN",2014,7429,179.585,7510,"Kg","Parts of the pumps and liquid eleva"
"LBN",2014,3347,175.546,59694,"Kg","Waste oils"
"LBN",2014,230,172.064,40440,"Kg","Butter & other fats & oils derived "
"LBN",2014,7311,170.112,NA,"N.Q.","Machine tools for working any mater"
"LBN",2014,2771,169.835,NA,"N.Q.","Industrial diamonds, sorted, whethe"
"LBN",2014,5754,166.118,56610,"Kg","Amino resins, phenolic resins and p"
"LBN",2014,1221,164.627,4094,"Kg","Cigars, cheroots & cigarillos, cont"
"LBN",2014,2881,163.519,248125,"Kg","Slag, ash & residues (other than fr"
"LBN",2014,7932,163.213,NA,"N.Q.","Ships, boats and other vessels (oth"
"LBN",2014,5977,162.946,74107,"Kg","Lubricating preparations (including"
"LBN",2014,7316,162.162,NA,"N.Q.","Machine tools for deburring, sharpe"
"LBN",2014,7224,159.289,6,"Item","Wheeled tractors (other than those "
"LBN",2014,4218,158.944,39034,"Kg","Sesame (Sesamum) oil & its fraction"
"LBN",2014,221,158.291,98779,"Kg","Milk (including skimmed milk) and c"
"LBN",2014,7438,157.694,14535,"Kg","Parts for the pumps, compressors, f"
"LBN",2014,7459,155.667,NA,"N.Q.","Other non-electrical machines and p"
"LBN",2014,8469,154.991,NA,"N.Q.","Gloves, mittens and mitts, knitted "
"LBN",2014,5919,154.17,52339,"Kg","Other products of group 591, put up"
"LBN",2014,5419,152.383,2552,"Kg","Pharmaceutical goods, other than me"
"LBN",2014,8812,151.976,NA,"N.Q.","Cinematographic cameras and project"
"LBN",2014,6966,149.362,27555,"Kg","Spoons, forks, ladles, skimmers, ca"
"LBN",2014,7244,148.881,NA,"N.Q.","Machines for extruding, drawing, te"
"LBN",2014,3222,148.225,180828,"Kg","Lignite, whether or not pulverized "
"LBN",2014,6259,147.636,NA,"N.Q.","Other tyres (including retreaded ty"
"LBN",2014,8416,147.512,NA,"N.Q.","Singlets and other vests, underpant"
"LBN",2014,7315,146.62,NA,"N.Q.","Machine tools for milling, threadin"
"LBN",2014,7484,145.011,NA,"N.Q.","Gears & gearing, other than toothed"
"LBN",2014,6561,143.548,16005,"Kg","Narrow woven fabrics (other than go"
"LBN",2014,7374,143.173,NA,"N.Q.","Machinery and apparatus for solderi"
"LBN",2014,6963,142.266,NA,"N.Q.","Razors and razor-blades (including "
"LBN",2014,6618,141.242,61888,"Kg","Construction materials of asbestos-"
"LBN",2014,7853,140.888,NA,"N.Q.","Invalid carriages, whether or not m"
"LBN",2014,459,139.968,63295,"Kg","Buckwheat, millet and canary seed; "
"LBN",2014,6332,136.275,26812,"Kg","Agglomerated cork (with or without "
"LBN",2014,6595,135.99,NA,"N.Q.","Carpets and other textile floor cov"
"LBN",2014,5973,135.966,106671,"Kg","Prepared liquids for hydraulic tran"
"LBN",2014,722,135.361,36644,"Kg","Cocoa powder not containing added s"
"LBN",2014,8447,134.986,15712,"Item","Blouses, shirts & shirt-blouses, wo"
"LBN",2014,6522,132.346,35234,"Kg","Cotton fabrics, woven, unbleached ("
"LBN",2014,8859,132.274,NA,"N.Q.","Time-measuring equipment and access"
"LBN",2014,7313,132.227,NA,"N.Q.","Lathes for removing metal (other th"
"LBN",2014,6351,131.295,NA,"N.Q.","Packings and cable-drums of wood; w"
"LBN",2014,7425,130.801,NA,"N.Q.","Rotary positive displacement pumps,"
"LBN",2014,2119,130.118,145715,"Kg","Hides and skins, n.e.s.; waste and "
"LBN",2014,813,130.107,270632,"Kg","Oil-cake and other solid residues ("
"LBN",2014,5742,128.848,33310,"Kg","Epoxide resins"
"LBN",2014,6579,127.992,42089,"Kg","Special products of textile materia"
"LBN",2014,7753,127.034,533,"Item","Dishwashing machines of the househo"
"LBN",2014,3352,126.935,114114,"Kg","Mineral tars and products of their "
"LBN",2014,449,126.499,232699,"Kg","Other maize, unmilled"
"LBN",2014,6781,123.93,126448,"Kg","Wire of iron or non-alloy steel"
"LBN",2014,7339,122.497,NA,"N.Q.","Other machine tools for working met"
"LBN",2014,8912,118.611,13077,"Kg","Bombs, grenades, torpedoes, mines, "
"LBN",2014,14,118.306,35503,"Item","Poultry, live (i.e., fowls of the s"
"LBN",2014,8438,117.61,23558,"Item","Underpants, briefs, nightshirts, py"
"LBN",2014,6551,117.262,45071,"Kg","Pile fabrics (including long pile f"
"LBN",2014,7479,116.401,10270,"Kg","Parts for the appliances of group 7"
"LBN",2014,8483,113.461,41,"Kg","Articles of apparel, clothing acces"
"LBN",2014,6952,113.44,32708,"Kg","Handsaws, files, rasps, pliers, pin"
"LBN",2014,6957,112.875,15301,"Kg","Tools of two/more of the headings o"
"LBN",2014,3351,111.088,65196,"Kg","Petroleum jelly; paraffin wax, micr"
"LBN",2014,7492,109.701,5492,"Kg","Gaskets & similar joints of metal s"
"LBN",2014,121,108.699,9605,"Kg","Meat of sheep or goats, fresh, chil"
"LBN",2014,8719,107.196,NA,"N.Q.","Liquid crystal devices, n.e.s.; las"
"LBN",2014,5322,105.912,25660,"Kg","Tanning extracts of vegetable origi"
"LBN",2014,5972,104.757,19115,"Kg","Anti-knock preparations, oxidation "
"LBN",2014,7754,103.972,NA,"N.Q.","Shavers and hair clippers, with sel"
"LBN",2014,8981,102.466,NA,"N.Q.","Pianos and other string musical ins"
"LBN",2014,3250,102.399,73038,"Kg","Coke & semi-coke (including char) o"
"LBN",2014,6941,102.196,36503,"Kg","Nails, tacks, drawing-pins, corruga"
"LBN",2014,7937,99.98,NA,"N.Q.","Tugs & pusher craft"
"LBN",2014,576,99.112,169533,"Kg","Figs, fresh/dried"
"LBN",2014,7271,98.039,NA,"N.Q.","Machinery used in the milling indus"
"LBN",2014,547,98.015,56502,"Kg","Vegetables provisionally preserved "
"LBN",2014,6582,95.708,44885,"Kg","Tarpaulins, awnings and sun-blinds;"
"LBN",2014,6117,91.857,27221,"Kg","Leather of other animals, without h"
"LBN",2014,7435,91.588,NA,"N.Q.","Centrifuges (including centrifugal "
"LBN",2014,361,90.018,6325,"Kg","Crustaceans, frozen"
"LBN",2014,8982,89.521,NA,"N.Q.","Musical instruments (other than pia"
"LBN",2014,7764,87.904,NA,"N.Q.","Electronic integrated circuits"
"LBN",2014,7119,87.661,6190,"Kg","Parts for the boilers and auxiliary"
"LBN",2014,5921,87.633,67564,"Kg","Starches, inulin and wheat gluten"
"LBN",2014,8431,87.605,1978,"Item","Overcoats, car coats, capes, cloaks"
"LBN",2014,7613,86.702,NA,"N.Q.","Cathode-ray tube monitors"
"LBN",2014,7768,86.264,688,"Kg","Piezoelectric crystals, mounted; pa"
"LBN",2014,6793,85.982,61669,"Kg","Other tubes and pipes (e.g., welded"
"LBN",2014,7862,85.659,4,"Item","Trailers and semi-trailers for the "
"LBN",2014,6535,85.322,6521,"Kg","Fabrics, woven, of artificial filam"
"LBN",2014,7359,84.544,11679,"Kg","Parts, n.e.s., and accessories suit"
"LBN",2014,2221,84.203,85958,"Kg","Groundnuts (peanuts), not roasted o"
"LBN",2014,7526,83.819,NA,"N.Q.","Input/output units, whether/not con"
"LBN",2014,179,82.318,9169,"Kg","Other prepared/preserved meat/meat "
"LBN",2014,7468,81.753,NA,"N.Q.","Other ball-/roller bearings (includ"
"LBN",2014,5237,78.916,85993,"Kg","Carbonates; peroxocarbonates (perca"
"LBN",2014,7412,78.5,5083,"Kg","Furnace burners for liquid fuel, fo"
"LBN",2014,8821,77.332,6692,"Kg","Chemical preparations for photograp"
"LBN",2014,5839,77.32,27453,"Kg","Monofilament of other plastic of wh"
"LBN",2014,6623,75.195,341506,"Kg","Refractory bricks and other refract"
"LBN",2014,2732,75.176,81808,"Kg","Gypsum, plasters, limestone flux, l"
"LBN",2014,6291,74.856,3746,"Kg","Hygienic or pharmaceutical articles"
"LBN",2014,6575,74.836,27732,"Kg","Twine, cordage, ropes and cables an"
"LBN",2014,2450,72.726,224004,"Kg","Fuel wood (excluding wood waste) an"
"LBN",2014,910,71.889,14869,"Kg","Margarine; edible mixtures or prepa"
"LBN",2014,7423,70.136,2,"Item","Concrete pumps"
"LBN",2014,5983,69.108,18044,"Kg","Artificial waxes and prepared waxes"
"LBN",2014,8924,68.659,12514,"Kg","Postcards, personal greeting, messa"
"LBN",2014,6965,67.45,4823,"Kg","Other articles of cutlery (e.g., ha"
"LBN",2014,8951,67.261,13727,"Kg","Office and stationery supplies, of "
"LBN",2014,5629,67.177,37426,"Kg","Fertilizers, n.e.s."
"LBN",2014,5138,67.13,26812,"Kg","Polycarboxylic acids and their anhy"
"LBN",2014,8721,66.695,NA,"N.Q.","Dental instruments and appliances, "
"LBN",2014,6812,64.83,3426,"Kg","Platinum and other metals of the pl"
"LBN",2014,8441,64.789,1320,"Item","Overcoats, car coats, capes, cloaks"
"LBN",2014,2783,62.622,321254,"Kg","Sodium chloride, pure, & common sal"
"LBN",2014,6546,62.223,17304,"Kg","Fabrics, woven, of glass fibres (in"
"LBN",2014,2922,61.941,3607,"Kg","Lac; natural gums, resins, gum resi"
"LBN",2014,721,61.648,2011,"Kg","Cocoa beans, whole/broken, raw/roas"
"LBN",2014,6992,60.65,16587,"Kg","Chain (other than articulated link "
"LBN",2014,5122,60.047,28444,"Kg","Other acyclic alcohols, and the hal"
"LBN",2014,345,58.805,4527,"Kg","Fish fillets, fresh or chilled, and"
"LBN",2014,2782,58.739,145897,"Kg","Clays and other refractory minerals"
"LBN",2014,619,57.759,19424,"Kg","Other sugars (including chemically "
"LBN",2014,7852,57.65,245,"Item","Bicycles & other cycles (including "
"LBN",2014,6994,55.908,34277,"Kg","Springs & leaves for springs, of ir"
"LBN",2014,7633,55.72,NA,"N.Q.","Sound recording or reproducing appa"
"LBN",2014,8811,55.447,NA,"N.Q.","Photographic (other than cinematogr"
"LBN",2014,8974,54.972,732,"Kg","Other articles of precious metal or"
"LBN",2014,6713,54.589,15000,"Kg","Granules and powders, of pig-iron, "
"LBN",2014,4222,54.001,33620,"Kg","Palm oil and its fractions"
"LBN",2014,8857,53.53,NA,"N.Q.","Clocks"
"LBN",2014,751,52.816,19801,"Kg","Pepper of the genus Piper; fruits o"
"LBN",2014,2322,52.649,142270,"Kg","Reclaimed rubber; waste and scrap o"
"LBN",2014,7111,52.214,17405,"Kg","Steam or other vapour-generating bo"
"LBN",2014,7243,51.901,NA,"N.Q.","Sewing-machines (other than book-se"
"LBN",2014,471,51.718,34944,"Kg","Cereal flours (other than of wheat "
"LBN",2014,8994,51.619,NA,"N.Q.","Umbrellas, sun umbrellas, walking-s"
"LBN",2014,7245,51.6,3,"Item","Weaving machines, knitting-machines"
"LBN",2014,583,51.261,21044,"Kg","Fruit and nuts, uncooked or cooked "
"LBN",2014,7312,51.169,NA,"N.Q.","Machining centres, unit constructio"
"LBN",2014,5113,51.079,37210,"Kg","Halogenated derivatives of hydrocar"
"LBN",2014,8731,50.862,NA,"N.Q.","Gas, liquid or electricity supply o"
"LBN",2014,4223,50.819,14600,"Kg","Coconut (copra) oil and its fractio"
"LBN",2014,5312,49.279,23832,"Kg","Synthetic organic products of a kin"
"LBN",2014,5226,49.146,36029,"Kg","Other inorganic bases and metal oxi"
"LBN",2014,8841,48.021,NA,"N.Q.","Optical fibres and optical fibre bu"
"LBN",2014,6753,45.072,12250,"Kg","Flat-rolled products of stainless s"
"LBN",2014,6516,44.816,15059,"Kg","Other synthetic filament yarn (othe"
"LBN",2014,6715,44.71,28850,"Kg","Other ferro-alloys (excluding radio"
"LBN",2014,5249,44.161,20388,"Kg","Inorganic and organic chemical prod"
"LBN",2014,6953,44.016,4080,"Kg","Spanners & wrenches, hand-operated "
"LBN",2014,8999,43.788,3520,"Kg","Manufactured goods, n.e.s."
"LBN",2014,6514,42.809,4869,"Kg","Sewing thread of man-made fibres, w"
"LBN",2014,5814,42.448,18534,"Kg","Other tubes, pipes & hoses, not rei"
"LBN",2014,621,42.111,4871,"Kg","Vegetables, fruit, nuts, fruit-peel"
"LBN",2014,5238,41.916,26133,"Kg","Other metal salts and peroxysalts o"
"LBN",2014,6593,41.871,1267,"Area  SM","Kelem, Schumacks, Karamanie & simil"
"LBN",2014,1222,41.733,6034,"Kg","Cigarettes containing tobacco"
"LBN",2014,6543,39.483,2117,"Kg","Fabrics, woven, of wool or of fine "
"LBN",2014,8822,39.033,2445,"Kg","Photographic plates & film in the f"
"LBN",2014,4113,38.967,441175,"Kg","Animal oils, fats and greases, n.e."
"LBN",2014,6536,38.807,1411,"Kg","Fabrics, woven, containing 85%/more"
"LBN",2014,7831,38.62,NA,"N.Q.","Motor vehicles for the transport of"
"LBN",2014,1213,38.182,121645,"Kg","Tobacco refuse"
"LBN",2014,7417,38.146,NA,"N.Q.","Gas generators, distilling or recti"
"LBN",2014,6254,38.078,1704,"Item","Tyres, pneumatic, new, of a kind us"
"LBN",2014,8941,37.193,4957,"Kg","Baby carriages & parts thereof, n.e"
"LBN",2014,6563,36.58,3336,"Kg","Gimped yarn, and strip and the like"
"LBN",2014,7248,36.331,NA,"N.Q.","Machinery (other than sewing-machin"
"LBN",2014,1223,36.131,10046,"Kg","Other manufactured tobacco (includi"
"LBN",2014,6745,35.345,28846,"Kg","Flat-rolled products of iron or non"
"LBN",2014,8813,35.236,NA,"N.Q.","Photographic and cinematographic ap"
"LBN",2014,5221,34.751,12050,"Kg","Carbon (including carbon black), n."
"LBN",2014,4212,34.725,12360,"Kg","Cotton seed oil and its fractions"
"LBN",2014,8996,34.26,NA,"N.Q.","Orthopaedic appliances (including c"
"LBN",2014,125,33.593,56000,"Kg","Edible offal of bovine animals, swi"
"LBN",2014,422,33.342,25845,"Kg","Rice, husked but not further prepar"
"LBN",2014,5233,32.823,17217,"Kg","Hypochlorites; commercial calcium h"
"LBN",2014,8843,32.814,2255,"Kg","Lenses, prisms, mirrors and other o"
"LBN",2014,7598,32.261,1202,"Kg","Parts & accessories equally suitabl"
"LBN",2014,7723,32.181,1392,"Kg","Electrical resistors (including rhe"
"LBN",2014,5161,31.809,9166,"Kg","Ethers, alcohol peroxides, ether pe"
"LBN",2014,5911,31.478,6125,"Kg","Insecticides put up in forms/packin"
"LBN",2014,6112,31.382,1846,"Kg","Composition leather with a basis of"
"LBN",2014,6943,30.977,3673,"Kg","Nails, tacks, drawing-pins, staples"
"LBN",2014,6968,30.973,6638,"Kg","Knives with cutting blades, serrate"
"LBN",2014,5154,30.735,3840,"Kg","Organo-sulphur compounds"
"LBN",2014,6519,30.333,6161,"Kg","Yarn of textile fibres, n.e.s. (inc"
"LBN",2014,7481,29.602,NA,"N.Q.","Transmission shafts (including cams"
"LBN",2014,7489,29.595,7176,"Kg","Parts, n.e.s., for the articles of "
"LBN",2014,8511,28.264,1233,"Pair","Footwear incorporating a protective"
"LBN",2014,6964,28,3118,"Kg","Scissors, tailors' shears & similar"
"LBN",2014,7472,27.642,6227,"Kg","Valves for oleohydraulic/pneumatic "
"LBN",2014,5712,27.249,15125,"Kg","Ethylene-vinyl acetate copolymers"
"LBN",2014,6515,27.092,18488,"Kg","Synthetic filament yarn (other than"
"LBN",2014,2734,26.823,105955,"Kg","Pebbles, gravel, broken/crushed sto"
"LBN",2014,7419,26.779,8382,"Kg","Parts, n.e.s., for the machinery of"
"LBN",2014,6544,26.364,281,"Kg","Fabrics, woven, of flax"
"LBN",2014,6122,25.877,2725,"Kg","Saddlery & harness for any animal ("
"LBN",2014,2723,24.829,13834,"Kg","Natural calcium phosphates, natural"
"LBN",2014,2721,24.812,75343,"Kg","Animal/vegetable fertilizers, wheth"
"LBN",2014,5815,23.342,5420,"Kg","Tubes, pipes & hoses, not reinforce"
"LBN",2014,2224,22.902,26777,"Kg","Sunflower seeds"
"LBN",2014,7133,22.056,NA,"N.Q.","Internal combustion piston engines,"
"LBN",2014,372,21.833,4077,"Kg","Crustaceans, molluscs and other aqu"
"LBN",2014,8714,20.902,NA,"N.Q.","Compound optical microscopes (inclu"
"LBN",2014,7939,20.036,NA,"N.Q.","Other floating structures (e.g., ra"
"LBN",2014,7832,19.996,1,"Item","Road tractors for semi-trailers"
"LBN",2014,2479,19.986,168,"m³","Woods in the rough/roughly squared,"
"LBN",2014,5162,19.923,1135,"Kg","Aldehyde-, ketone- and quinone-func"
"LBN",2014,5981,19.841,15348,"Kg","Wood- and resin-based chemical prod"
"LBN",2014,175,19.672,2283,"Kg","Meat & offal (other than liver), of"
"LBN",2014,6115,19.42,1050,"Kg","Sheep- or lambskin leather, without"
"LBN",2014,6638,19.291,8569,"Kg","Manufactures of asbestos; friction "
"LBN",2014,2634,18.98,9139,"Kg","Cotton, carded/combed"
"LBN",2014,5933,18.958,6325,"Kg","Fireworks, signalling flares, rain "
"LBN",2014,7469,18.641,1009,"Kg","Parts of ball- and roller bearings"
"LBN",2014,7762,18.568,NA,"N.Q.","Other electronic valves and tubes ("
"LBN",2014,7485,17.953,NA,"N.Q.","Flywheels & pulleys (including pull"
"LBN",2014,6891,17.828,12420,"Kg","Tungsten (wolfram), molybdenum, tan"
"LBN",2014,6131,17.656,1295,"Kg","Whole furskins, with or without hea"
"LBN",2014,592,17.537,6950,"Kg","Grapefruit juice"
"LBN",2014,7786,17.287,706,"Kg","Electrical capacitors, fixed, varia"
"LBN",2014,3223,17.172,46000,"Kg","Peat (including peat litter), wheth"
"LBN",2014,344,16.898,439,"Kg","Fish fillets, frozen"
"LBN",2014,2633,16.856,150,"Kg","Cotton waste (including yarn waste "
"LBN",2014,6512,16.486,13790,"Kg","Cotton sewing thread, whether or no"
"LBN",2014,2733,16.307,87655,"Kg","Natural sands of all kinds, whether"
"LBN",2014,2631,16.109,23486,"Kg","Cotton (other than linters), not ca"
"LBN",2014,8711,16.006,NA,"N.Q.","Binoculars, monoculars, other optic"
"LBN",2014,7763,15.908,NA,"N.Q.","Diodes, transistors and similar sem"
"LBN",2014,7461,15.787,NA,"N.Q.","Ball-bearings"
"LBN",2014,5157,15.716,260,"Kg","Other heterocyclic compounds; nucle"
"LBN",2014,111,15.585,738,"Kg","Meat of bovine animals, fresh or ch"
"LBN",2014,5114,15.573,13200,"Kg","Sulphonated, nitrated/nitrosated de"
"LBN",2014,7372,15.233,NA,"N.Q.","Metal-rolling mills and rolls and o"
"LBN",2014,7249,14.791,3912,"Kg","Parts for the machines of subgroups"
"LBN",2014,3431,14.149,8905,"Kg","Natural gas, liquefied"
"LBN",2014,7424,13.895,NA,"N.Q.","Reciprocating positive displacement"
"LBN",2014,2226,13.497,6000,"Kg","Rape, colza and mustard seeds"
"LBN",2014,2682,13.084,32700,"Kg","Other wool, not carded or combed"
"LBN",2014,8831,12.909,NA,"N.Q.","Cinematographic film, exposed & dev"
"LBN",2014,6578,12.88,1525,"Kg","Rubber thread and cord, textile-cov"
"LBN",2014,7483,12.667,2768,"Kg","Articulated link chain and parts th"
"LBN",2014,6542,12.204,231,"Kg","Fabrics, woven, containing 85% or m"
"LBN",2014,7732,11.986,1003,"Kg","Electrical insulating equipment"
"LBN",2014,7486,11.795,NA,"N.Q.","Clutches & shaft couplings (includi"
"LBN",2014,7622,11.572,NA,"N.Q.","Radio-broadcast receivers capable o"
"LBN",2014,7351,11.277,1122,"Kg","Work holders, self-opening die-head"
"LBN",2014,6518,11.249,5885,"Kg","Yarn (other than sewing thread) of "
"LBN",2014,5988,11.02,1100,"Kg","Catalysts and catalytic preparation"
"LBN",2014,6782,10.588,7162,"Kg","Wire of stainless steel or other al"
"LBN",2014,7471,10.541,2329,"Kg","Pressure-reducing valves"
"LBN",2014,6562,10.388,254,"Kg","Labels, badges and similar articles"
"LBN",2014,4213,10.292,4300,"Kg","Groundnut (peanut) oil and its frac"
"LBN",2014,6571,10.225,10048,"Kg","Felt, whether or not impregnated, c"
"LBN",2014,5112,9.907,6050,"Kg","Cyclic hydrocarbons"
"LBN",2014,421,9.823,6254,"Kg","Rice in the husk (paddy/rough rice)"
"LBN",2014,8826,9.789,1370,"Kg","Photographic plates & film, exposed"
"LBN",2014,3354,9.778,3300,"Kg","Petroleum bitumen, petroleum coke a"
"LBN",2014,7628,9.764,38,"Item","Other radio-broadcast receivers, wh"
"LBN",2014,7919,9.734,3020,"Kg","Railway or tramway track fixtures a"
"LBN",2014,8138,9.629,505,"Kg","Parts of the portable electric lamp"
"LBN",2014,8989,9.625,537,"Kg","Parts & accessories of musical inst"
"LBN",2014,168,9.36,243,"Kg","Meat and edible meat offal, other t"
"LBN",2014,6331,9.327,859,"Kg","Articles of natural cork"
"LBN",2014,7918,8.998,NA,"N.Q.","Railway or tramway freight and main"
"LBN",2014,7482,8.771,NA,"N.Q.","Bearing housings and plain shaft be"
"LBN",2014,7213,8.741,NA,"N.Q.","Milking machines and dairy machiner"
"LBN",2014,2312,8.682,620,"Kg","Natural rubber (other than latex)"
"LBN",2014,6932,8.67,4943,"Kg","Barbed wire of iron/steel; twisted "
"LBN",2014,4224,8.278,5785,"Kg","Palm kernel or babassu oil and frac"
"LBN",2014,2462,8.276,19840,"Kg","Sawdust & wood waste & scrap, wheth"
"LBN",2014,412,8.086,7809,"Kg","Other wheat (including spelt) & mes"
"LBN",2014,1122,8.033,416,"Liter","Fermented beverages, n.e.s. (e.g., "
"LBN",2014,7935,7.505,NA,"N.Q.","Light vessels, fire-floats, dredger"
"LBN",2014,3221,7.32,1070,"Kg","Briquettes, ovoids & similar solid "
"LBN",2014,7621,7.093,80,"Item","Radio-broadcast receivers not capab"
"LBN",2014,6671,6.988,1,"Kg","Pearls (natural or cultured), wheth"
"LBN",2014,7842,6.869,NA,"N.Q.","Bodies (including cabs), for the mo"
"LBN",2014,3353,6.703,8660,"Kg","Pitch and pitch coke, obtained from"
"LBN",2014,2237,6.699,1220,"Kg","Oil-seeds & oleaginous fruits, n.e."
"LBN",2014,5832,6.663,1975,"Kg","Monofilament,vinyl chloride, of whi"
"LBN",2014,6763,6.548,522,"Kg","Bars and rods of iron or steel, not"
"LBN",2014,5111,6.213,1237,"Kg","Acyclic hydrocarbons"
"LBN",2014,6821,6.191,126,"Kg","Copper, refined and unrefined; copp"
"LBN",2014,7164,6.133,NA,"N.Q.","Electric rotary converters"
"LBN",2014,129,6.033,518,"Kg","Meat and edible meat offal, fresh, "
"LBN",2014,6944,5.829,1318,"Kg","Nails, tacks, staples (other than t"
"LBN",2014,5251,5.363,1,"Kg","Radioactive chemical elements and r"
"LBN",2014,5731,5.289,2800,"Kg","Polyvinyl chloride"
"LBN",2014,8732,4.71,NA,"N.Q.","Revolution counters, production cou"
"LBN",2014,5145,4.675,900,"Kg","Amine-function compounds"
"LBN",2014,8823,4.634,85,"Kg","Photographic film in rolls, sensiti"
"LBN",2014,5753,4.605,1290,"Kg","Polyamides"
"LBN",2014,2686,4.6,500,"Kg","Waste of wool or of fine or coarse "
"LBN",2014,15,4.594,NA,"N.Q.","Horses, asses, mules & hinnies, liv"
"LBN",2014,2223,4.531,400,"Kg","Cotton seeds"
"LBN",2014,2321,4.506,259,"Kg","Synthetic rubber and factice derive"
"LBN",2014,8965,4.389,275,"Kg","Collections & collectors' pieces of"
"LBN",2014,352,4.19,500,"Kg","Fish, salted but not dried or smoke"
"LBN",2014,9610,4.182,317,"Kg","Coin (other than gold coin), not be"
"LBN",2014,6513,4.076,12333,"Kg","Cotton yarn, other than sewing thre"
"LBN",2014,7811,3.999,1,"Item","Vehicles specially designed for tra"
"LBN",2014,6212,3.896,403,"Kg","Other forms (e.g., rods, tubes and "
"LBN",2014,7474,3.759,197,"Kg","Safety-/relief valves"
"LBN",2014,7473,3.732,635,"Kg","Check valves"
"LBN",2014,5155,3.514,100,"Kg","Other organo-inorganic compounds"
"LBN",2014,2687,3.315,9000,"Kg","Wool and fine or coarse animal hair"
"LBN",2014,611,3.147,2375,"Kg","Sugars, beet or cane, raw, in solid"
"LBN",2014,241,3,550,"Kg","Grated/powdered cheese, of all kind"
"LBN",2014,6872,2.981,523,"Kg","Tin bars, rods, profiles & wire"
"LBN",2014,5999,2.897,1254,"Kg","Other wastes from chemical/allied i"
"LBN",2014,6211,2.736,667,"Kg","Compounded rubber, unvulcanized, in"
"LBN",2014,2785,2.556,5000,"Kg","Quartz, mica, feldspar, fluorspar, "
"LBN",2014,582,2.467,969,"Kg","Fruit and nuts, provisionally prese"
