"CountryCode","Period","ProductCode","TradeValue","Quantity","QuantityUnit","ProductDescription"
"DZA",2013,5534,1.694,279,"Kg","Preparations for oral/dental hygien"
"DZA",2013,7526,1.62,233,"Item","Input/output units, whether/not con"
"DZA",2013,8211,1.514,1,"Item","Seats (other than those of heading "
"DZA",2013,2785,1.504,1010,"Kg","Quartz, mica, feldspar, fluorspar, "
"DZA",2013,6213,1.372,80,"Kg","Vulcanized rubber thread and cord; "
"DZA",2013,576,1.332,390,"Kg","Figs, fresh/dried"
"DZA",2013,546,1.331,500,"Kg","Vegetables (uncooked or cooked by s"
"DZA",2013,5514,1.282,80,"Kg","Mixtures of odoriferous substances "
"DZA",2013,8461,1.248,26,"Item","Clothing accessories (other than th"
"DZA",2013,544,1.203,572,"Kg","Tomatoes, fresh/chilled"
"DZA",2013,7249,1.174,34,"Kg","Parts for the machines of subgroups"
"DZA",2013,8131,1.167,NA,"N.Q.","Lamps and lighting fittings (includ"
"DZA",2013,575,1.131,368,"Kg","Grapes, fresh or dried"
"DZA",2013,7863,1.131,2,"Item","Containers (including containers fo"
"DZA",2013,6943,1.129,159,"Kg","Nails, tacks, drawing-pins, staples"
"DZA",2013,7784,1.122,12,"Item","Electromechanical tools for working"
"DZA",2013,4213,1.102,182,"Kg","Groundnut (peanut) oil and its frac"
"DZA",2013,7724,1.093,146,"Kg","Electrical apparatus for switching "
"DZA",2013,564,1.088,316,"Kg","Flour, meal, flakes, granules and p"
"DZA",2013,6595,1.028,35,"Area  SM","Carpets and other textile floor cov"
"DZA",2013,7452,1.027,8,"Kg","Dishwashing machines (other than ho"
"DZA",2013,1222,1.017,19,"Kg","Cigarettes containing tobacco"
"DZA",2013,7161,0.992,1,"Item","Electric motors of an output not > "
"DZA",2013,7484,0.976,1,"Item","Gears & gearing, other than toothed"
"DZA",2013,5223,0.939,NA,"N.Q.","Inorganic acids and inorganic oxyge"
"DZA",2013,8481,0.907,200,"Kg","Articles of apparel and clothing ac"
"DZA",2013,6944,0.896,40,"Kg","Nails, tacks, staples (other than t"
"DZA",2013,6424,0.845,4,"Kg","Paper and paperboard, cut to size o"
"DZA",2013,8484,0.797,201,"Kg","Headgear and fittings therefor, n.e"
"DZA",2013,2815,0.761,540,"Kg","Iron ores & concentrates, not agglo"
"DZA",2013,8857,0.761,2,"Item","Clocks"
"DZA",2013,7711,0.759,64,"Item","Transformers, electrical"
"DZA",2013,7483,0.719,61,"Kg","Articulated link chain and parts th"
"DZA",2013,732,0.713,103,"Kg","Other food preparations containing "
"DZA",2013,7649,0.705,41,"Kg","Parts and accessories suitable for "
"DZA",2013,5513,0.694,1500,"Kg","Essential oils (terpeneless or not)"
"DZA",2013,8426,0.687,22,"Item","Trousers, bib & brace overalls, bre"
"DZA",2013,8319,0.642,103,"Kg","Binocular cases, camera cases, musi"
"DZA",2013,986,0.641,405,"Kg","Yeasts (active/inactive); other sin"
"DZA",2013,4211,0.621,480,"Kg","Soya bean oil and its fractions"
"DZA",2013,6973,0.543,NA,"N.Q.","Cooking or heating apparatus of a k"
"DZA",2013,5312,0.511,50,"Kg","Synthetic organic products of a kin"
"DZA",2013,7461,0.476,33,"Item","Ball-bearings"
"DZA",2013,589,0.471,491,"Kg","Fruit, nuts and other edible parts "
"DZA",2013,5977,0.467,86,"Kg","Lubricating preparations (including"
"DZA",2013,8749,0.442,37,"Kg","Parts & accessories for machines, a"
"DZA",2013,7853,0.44,47,"Kg","Invalid carriages, whether or not m"
"DZA",2013,5423,0.436,42,"Kg","Medicaments containing alkaloids or"
"DZA",2013,8311,0.404,1450,"Item","Handbags, whether or not with shoul"
"DZA",2013,910,0.375,484,"Kg","Margarine; edible mixtures or prepa"
"DZA",2013,5839,0.359,220,"Kg","Monofilament of other plastic of wh"
"DZA",2013,712,0.347,60,"Kg","Coffee, roasted"
"DZA",2013,8452,0.344,55,"Item","Garments made up of fabrics of subg"
"DZA",2013,7283,0.328,NA,"N.Q.","Machinery for sorting, screening, s"
"DZA",2013,8312,0.323,272,"Item","Trunks, suitcases, vanity cases, ex"
"DZA",2013,8414,0.314,50,"Item","Trousers, bib & brace overalls, bre"
"DZA",2013,8412,0.313,85,"Item","Suits and ensembles"
"DZA",2013,7451,0.28,1,"Item","Tools for working in the hand, pneu"
"DZA",2013,7757,0.256,1,"Item","Electromechanical domestic applianc"
"DZA",2013,7512,0.252,500,"Item","Calculating machines and pocket-siz"
"DZA",2013,5414,0.248,50,"Kg","Vegetable alkaloids, natural or rep"
"DZA",2013,572,0.247,100,"Kg","Other citrus fruit, fresh or dried"
"DZA",2013,6635,0.241,34,"Kg","Slag-wool, rock-wool and similar mi"
"DZA",2013,2786,0.239,137,"Kg","Slag, dross, scalings and similar w"
"DZA",2013,6827,0.239,50,"Kg","Copper tubes, pipes and tube or pip"
"DZA",2013,2929,0.238,59,"Kg","Materials of vegetable origin, n.e."
"DZA",2013,172,0.235,50,"Kg","Sausages & similar products, of mea"
"DZA",2013,242,0.228,24,"Kg","Processed cheese, not grated/powder"
"DZA",2013,7768,0.217,260,"Kg","Piezoelectric crystals, mounted; pa"
"DZA",2013,6345,0.204,30,"Kg","Fibreboard of wood or other ligneou"
"DZA",2013,6422,0.198,34,"Kg","Envelopes, letter cards, plain post"
"DZA",2013,5243,0.188,0,"Kg","Salts of metal acids; organic and i"
"DZA",2013,2322,0.179,200,"Kg","Reclaimed rubber; waste and scrap o"
"DZA",2013,5139,0.176,33,"Kg","Carboxylic acids with additional ox"
"DZA",2013,7112,0.172,4,"Kg","Auxiliary plant for use with boiler"
"DZA",2013,3354,0.17,54,"Kg","Petroleum bitumen, petroleum coke a"
"DZA",2013,6423,0.169,16,"Kg","Registers, account-books, notebooks"
"DZA",2013,6351,0.168,2,"Item","Packings and cable-drums of wood; w"
"DZA",2013,6416,0.166,27,"Kg","Paper and paperboard, corrugated, c"
"DZA",2013,249,0.159,83,"Kg","Other cheese; curd"
"DZA",2013,7131,0.146,3,"Kg","Internal combustion piston engines "
"DZA",2013,8462,0.141,4,"Kg","Panty hose, tights, stockings, sock"
"DZA",2013,6577,0.134,135,"Kg","Wadding, wicks, and textile fabrics"
"DZA",2013,5157,0.132,NA,"N.Q.","Other heterocyclic compounds; nucle"
"DZA",2013,8482,0.122,16,"Kg","Articles of apparel and clothing ac"
"DZA",2013,6912,0.114,16,"Kg","Aluminium structures (excluding pre"
"DZA",2013,7441,0.105,3,"Kg","Works trucks, of the type used in f"
"DZA",2013,7119,0.103,150,"Kg","Parts for the boilers and auxiliary"
"DZA",2013,471,0.099,200,"Kg","Cereal flours (other than of wheat "
"DZA",2013,5816,0.099,6,"Kg","Other tubes, pipes & hoses"
"DZA",2013,6975,0.095,1,"Kg","Sanitary ware and parts thereof, n."
"DZA",2013,6354,0.085,4,"Kg","Manufactures of wood for domestic o"
"DZA",2013,6623,0.079,125,"Kg","Refractory bricks and other refract"
"DZA",2013,6991,0.07,4,"Kg","Locksmiths' wares, safes, strongbox"
"DZA",2013,7447,0.07,1,"Item","Continuous-action elevators and con"
"DZA",2013,8519,0.064,28,"Kg","Parts of footwear (including uppers"
"DZA",2013,8842,0.051,9,"Item","Spectacles and spectacle frames"
"DZA",2013,752,0.05,40,"Kg","Spices (except pepper and pimento)"
"DZA",2013,6211,0.047,1,"Kg","Compounded rubber, unvulcanized, in"
"DZA",2013,6593,0.045,2,"Area  SM","Kelem, Schumacks, Karamanie & simil"
"DZA",2013,5322,0.042,50,"Kg","Tanning extracts of vegetable origi"
"DZA",2013,5719,0.042,60,"Kg","Other polymers of ethylene, in prim"
"DZA",2013,6652,0.042,2,"Kg","Glassware of a kind used for table,"
"DZA",2013,8514,0.029,1,"Pair","Other footwear with uppers of leath"
"DZA",2013,6582,0.028,3,"Kg","Tarpaulins, awnings and sun-blinds;"
"DZA",2013,8972,0.019,NA,"N.Q.","Imitation jewellery"
"DZA",2013,2631,0.011,6,"Kg","Cotton (other than linters), not ca"
"DZA",2013,7782,0.008,2,"Item","Electric filament or discharge lamp"
"DZA",2013,7723,0.007,1,"Kg","Electrical resistors (including rhe"
"DZA",2013,722,0.004,20,"Kg","Cocoa powder not containing added s"
"DZA",2013,5158,0.004,NA,"N.Q.","Sulphonamides"
"DZA",2013,2239,0.003,10,"Kg","Flours & meals of oil-seeds/oleagin"
"DZA",2013,2665,0.001,0,"Kg","Synthetic staple fibres, not carded"
"DZA",2013,2690,0.001,40,"Kg","Worn clothing and other worn textil"
"DZA",2013,5931,0.001,10,"Kg","Propellent powders and other prepar"
"EGY",2013,3330,3059529.274,4361000000,"Kg","Crude petroleum"
"EGY",2013,3346,2548886.969,2826251800,"Kg","Petroleum oils & oils obtained from"
"EGY",2013,3431,1273561.828,3684330000,"Kg","Natural gas, liquefied"
"EGY",2013,5621,1077116.545,2809235635,"Kg","Mineral or chemical fertilizers, ni"
"EGY",2013,9710,901083.137,20734,"Kg","Gold, non-monetary (excluding gold "
"EGY",2013,7731,895923.98,103869441,"Kg","Insulated (including enamelled or a"
"EGY",2013,571,507966.297,1133652929,"Kg","Oranges, mandarins, clementines and"
"EGY",2013,6592,376793.896,NA,"N.Q.","Carpets and other textile floor cov"
"EGY",2013,5121,368922.204,NA,"N.Q.","Acyclic monohydric alcohols"
"EGY",2013,6842,365067.202,141822392,"Kg","Aluminium and aluminium alloys, wor"
"EGY",2013,545,350213.794,620419353,"Kg","Other fresh or chilled vegetables"
"EGY",2013,6732,339112.464,460328959,"Kg","Flat-rolled products of iron or non"
"EGY",2013,6624,334922.968,NA,"N.Q.","Non-refractory ceramic bricks, tile"
"EGY",2013,8414,332527.169,17992544,"Item","Trousers, bib & brace overalls, bre"
"EGY",2013,8215,306808.124,4488984,"Item","Furniture, n.e.s., of wood"
"EGY",2013,5711,290941.088,176208007,"Kg","Polyethylene"
"EGY",2013,3421,286134.281,380630000,"Kg","Propane, liquefied"
"EGY",2013,5429,282898.062,36683612,"Kg","Medicaments, n.e.s."
"EGY",2013,5984,274923.438,533893263,"Kg","Mixed alkylbenzenes & mixed alkylna"
"EGY",2013,8454,260492.002,46880934,"Item","T-shirts, singlets & other vests, k"
"EGY",2013,6513,256379.49,34620549,"Kg","Cotton yarn, other than sewing thre"
"EGY",2013,579,253441.049,233698535,"Kg","Fruit, fresh or dried, n.e.s."
"EGY",2013,2723,252881.074,1972901949,"Kg","Natural calcium phosphates, natural"
"EGY",2013,6584,241014.215,33387954,"Kg","Bed linen, table linen, toilet line"
"EGY",2013,8452,240111.07,11571654,"Kg","Garments made up of fabrics of subg"
"EGY",2013,5514,236133.362,9661357,"Kg","Mixtures of odoriferous substances "
"EGY",2013,242,234487.022,52220233,"Kg","Processed cheese, not grated/powder"
"EGY",2013,6613,233120.412,995723367,"Kg","Monumental or building stone, worke"
"EGY",2013,5221,231635.284,145292390,"Kg","Carbon (including carbon black), n."
"EGY",2013,6825,218056.399,30742146,"Kg","Copper plates, sheets and strip, of"
"EGY",2013,5822,214569.407,93482451,"Kg","Other plates, sheets, film, foil an"
"EGY",2013,541,205898.491,427907252,"Kg","Potatoes, fresh/chilled (not includ"
"EGY",2013,423,197761.183,334005125,"Kg","Rice, semi-milled or wholly milled,"
"EGY",2013,6761,197653.868,303849634,"Kg","Bars and rods, hot-rolled, in irreg"
"EGY",2013,9310,197468.884,NA,"N.Q.","Special transactions & commodities "
"EGY",2013,546,185217.583,477132326,"Kg","Vegetables (uncooked or cooked by s"
"EGY",2013,575,183730.224,88306082,"Kg","Grapes, fresh or dried"
"EGY",2013,3351,175603.689,152495987,"Kg","Petroleum jelly; paraffin wax, micr"
"EGY",2013,612,174125.009,237634201,"Kg","Other beet or cane sugar and chemic"
"EGY",2013,6841,173980.699,75134380,"Kg","Aluminium and aluminium alloys, unw"
"EGY",2013,5751,170123.275,100869307,"Kg","Polymers of propylene or of other o"
"EGY",2013,6574,169224.156,13209483,"Kg","Quilted textile products in the pie"
"EGY",2013,5226,167746.802,501850082,"Kg","Other inorganic bases and metal oxi"
"EGY",2013,6997,167672.326,29542552,"Kg","Articles, n.e.s., of copper, nickel"
"EGY",2013,6652,162610.607,75251608,"Kg","Glassware of a kind used for table,"
"EGY",2013,8939,161533.8,79323954,"Kg","Articles of plastics, n.e.s."
"EGY",2013,2731,157803.383,1841191893,"Kg","Building or monumental (dimension) "
"EGY",2013,542,153863.801,104339762,"Kg","Leguminous vegetables, dried, shell"
"EGY",2013,6612,140538.372,2694639621,"Kg","Portland cement, aluminous cement, "
"EGY",2013,5542,139900.65,142350176,"Kg","Organic surface-active agents (othe"
"EGY",2013,8932,139617.299,51718135,"Kg","Builders' ware of plastics"
"EGY",2013,6996,139159.211,68119535,"Kg","Articles of iron or steel, n.e.s."
"EGY",2013,249,136993.776,45855260,"Kg","Other cheese; curd"
"EGY",2013,6424,135930.328,92036803,"Kg","Paper and paperboard, cut to size o"
"EGY",2013,2631,135667.22,42027026,"Kg","Cotton (other than linters), not ca"
"EGY",2013,5334,130760.828,53260557,"Kg","Paints and varnishes (including ena"
"EGY",2013,8426,130499.884,7294589,"Item","Trousers, bib & brace overalls, bre"
"EGY",2013,1223,124592.827,25869500,"Kg","Other manufactured tobacco (includi"
"EGY",2013,5721,121717.713,64050426,"Kg","Polystyrene"
"EGY",2013,6429,121480.218,41648315,"Kg","Articles of paper pulp, paper, pape"
"EGY",2013,4229,120630.604,56371877,"Kg","Other fixed vegetable fats, crude, "
"EGY",2013,6911,119001.814,55066005,"Kg","Structures (excluding prefabricated"
"EGY",2013,567,113613.234,68527781,"Kg","Vegetables, prepared or preserved, "
"EGY",2013,7616,109952.969,359155,"Item","Reception apparatus for television,"
"EGY",2013,2924,109845.029,41742924,"Kg","Plants and parts of plants (includi"
"EGY",2013,8459,106048.413,NA,"N.Q.","Other garments, knitted or crochete"
"EGY",2013,6252,100450.263,585458,"Item","Tyres, pneumatic, new, of a kind us"
"EGY",2013,6973,99276.503,NA,"N.Q.","Cooking or heating apparatus of a k"
"EGY",2013,5622,98993.399,533053643,"Kg","Mineral or chemical fertilizers, ph"
"EGY",2013,6762,97112.729,138554960,"Kg","Bars and rods of iron or non-alloy "
"EGY",2013,5731,93576.761,69761791,"Kg","Polyvinyl chloride"
"EGY",2013,6724,90681.437,168453770,"Kg","Ingots and other primary forms, of "
"EGY",2013,815,88311.24,400070499,"Kg","Residues of starch manufacture and "
"EGY",2013,6741,86597.457,99619160,"Kg","Flat-rolled products of iron or non"
"EGY",2013,622,85809.534,33539398,"Kg","Sugar confectionery (including whit"
"EGY",2013,599,85787.746,101270078,"Kg","Juice of any single fruit (other th"
"EGY",2013,989,82805.447,36851555,"Kg","Food preparations, n.e.s."
"EGY",2013,7758,81892.23,NA,"N.Q.","Electrothermic appliances, n.e.s."
"EGY",2013,2929,81442.197,3859989,"Kg","Materials of vegetable origin, n.e."
"EGY",2013,733,80129.056,15784597,"Kg","Other food preparations containing "
"EGY",2013,7831,78392.848,NA,"N.Q.","Motor vehicles for the transport of"
"EGY",2013,8122,75158.219,2990136,"Item","Ceramic sinks, wash-basins, wash-ba"
"EGY",2013,5541,71786.57,40642446,"Kg","Soap; organic surface-active produc"
"EGY",2013,6824,71045.61,9322980,"Kg","Copper wire"
"EGY",2013,6114,69992.113,9998621,"Kg","Tanned or crust hides and skins of "
"EGY",2013,484,69870.044,20516612,"Kg","Bread, pastry, cakes, biscuits and "
"EGY",2013,5812,69540.083,41195704,"Kg","Tubes, pipes & hoses, rigid"
"EGY",2013,615,67792.762,464207289,"Kg","Molasses resulting from the extract"
"EGY",2013,3510,62528.62,952556,"1000 KW/H","Electric current"
"EGY",2013,6117,61665.052,4509297,"Kg","Leather of other animals, without h"
"EGY",2013,544,60531.101,74801022,"Kg","Tomatoes, fresh/chilled"
"EGY",2013,6524,59557.074,8241071,"Kg","Other woven fabrics, containing 85%"
"EGY",2013,2789,58247.094,62243650,"Kg","Minerals, crude, n.e.s."
"EGY",2013,5743,57744.755,32301890,"Kg","Polycarbonates, alkyd resins and ot"
"EGY",2013,2665,55495.335,21181408,"Kg","Synthetic staple fibres, not carded"
"EGY",2013,483,53853.037,55452269,"Kg","Macaroni, spaghetti & similar produ"
"EGY",2013,5533,53793.955,17231035,"Kg","Preparations for use on the hair"
"EGY",2013,6421,53708.417,35124172,"Kg","Cartons, boxes, cases, bags and oth"
"EGY",2013,7415,53528.253,NA,"N.Q.","Air-conditioning machines comprisin"
"EGY",2013,984,53181.525,NA,"N.Q.","Sauces and preparations therefore; "
"EGY",2013,6991,52614.894,7176812,"Kg","Locksmiths' wares, safes, strongbox"
"EGY",2013,8931,52392.902,17675199,"Kg","Articles for the conveyance or pack"
"EGY",2013,4215,51655.961,34694320,"Kg","Sunflower seed or safflower oil and"
"EGY",2013,7812,49839.16,6570,"Item","Motor vehicles for the transport of"
"EGY",2013,5419,47504.707,4247976,"Kg","Pharmaceutical goods, other than me"
"EGY",2013,8415,47482.041,3607392,"Item","Shirts"
"EGY",2013,5922,47459.948,15424914,"Kg","Albuminoidal substances, modified s"
"EGY",2013,6963,47138.103,NA,"N.Q.","Razors and razor-blades (including "
"EGY",2013,5981,45778.58,53226369,"Kg","Wood- and resin-based chemical prod"
"EGY",2013,6618,44590.605,66076613,"Kg","Construction materials of asbestos-"
"EGY",2013,8432,44104.117,NA,"N.Q.","Suits, ensembles, jackets, blazers,"
"EGY",2013,566,42042.33,35419522,"Kg","Vegetables prepared or preserved ot"
"EGY",2013,3211,42034.389,4156153920,"Kg","Anthracite, whether/not pulverized,"
"EGY",2013,4211,40167.988,30760776,"Kg","Soya bean oil and its fractions"
"EGY",2013,811,39447.186,181734455,"Kg","Hay and fodder, green or dry"
"EGY",2013,6523,39137.285,3828819,"Kg","Other woven fabrics, containing 85%"
"EGY",2013,6651,39019.243,79833799,"Kg","Containers, of glass, of a kind use"
"EGY",2013,6647,37802.358,48670992,"Kg","Safety glass, consisting of toughen"
"EGY",2013,548,37225.569,56002404,"Kg","Vegetable products, roots and tuber"
"EGY",2013,8722,37134.86,NA,"N.Q.","Instruments and appliances used in "
"EGY",2013,581,37005.729,18585803,"Kg","Jams, fruit jellies, marmalades, fr"
"EGY",2013,985,36992.989,13884869,"Kg","Soups & broths & preparations there"
"EGY",2013,8412,36707.259,NA,"N.Q.","Suits and ensembles"
"EGY",2013,5237,36524.745,261785994,"Kg","Carbonates; peroxocarbonates (perca"
"EGY",2013,2221,36128.901,16451050,"Kg","Groundnuts (peanuts), not roasted o"
"EGY",2013,461,36082.327,70345153,"Kg","Flour of wheat/of meslin"
"EGY",2013,6585,35953.559,3256305,"Kg","Curtains and other furnishing artic"
"EGY",2013,5513,35944.552,593816,"Kg","Essential oils (terpeneless or not)"
"EGY",2013,547,35601.837,338133867,"Kg","Vegetables provisionally preserved "
"EGY",2013,561,35440.466,27702995,"Kg","Vegetables, dried (excluding legumi"
"EGY",2013,6531,33729.503,4884745,"Kg","Fabrics, woven, of synthetic filame"
"EGY",2013,7843,33592.253,13476125,"Kg","Other parts and accessories of the "
"EGY",2013,6522,32907.359,3526539,"Kg","Cotton fabrics, woven, unbleached ("
"EGY",2013,2926,32065.278,NA,"N.Q.","Bulbs, tubers and rhizomes of flowe"
"EGY",2013,8442,31995.627,NA,"N.Q.","Suits, ensembles, jackets, blazers,"
"EGY",2013,2927,31989.596,7960390,"Kg","Cut flowers and foliage"
"EGY",2013,2687,31939.38,2455455,"Kg","Wool and fine or coarse animal hair"
"EGY",2013,589,31290.082,17658652,"Kg","Fruit, nuts and other edible parts "
"EGY",2013,3250,30144.788,334185846,"Kg","Coke & semi-coke (including char) o"
"EGY",2013,6581,29832.587,14098475,"Kg","Sacks and bags, of textile material"
"EGY",2013,6715,29185.259,21067975,"Kg","Other ferro-alloys (excluding radio"
"EGY",2013,7726,28918.79,2735308,"Kg","Boards, panels (including numerical"
"EGY",2013,6974,28665.39,15632777,"Kg","Table, kitchen or other household a"
"EGY",2013,986,28303.439,11256514,"Kg","Yeasts (active/inactive); other sin"
"EGY",2013,8451,28163.46,1844820,"Kg","Babies' garments and clothing acces"
"EGY",2013,6924,27802.671,7653283,"Kg","Tanks, casks, drums, cans, boxes an"
"EGY",2013,2733,27476.215,929573909,"Kg","Natural sands of all kinds, whether"
"EGY",2013,583,27125.606,66166124,"Kg","Fruit and nuts, uncooked or cooked "
"EGY",2013,5754,26750.499,20844591,"Kg","Amino resins, phenolic resins and p"
"EGY",2013,2925,26707.55,15642354,"Kg","Seeds, fruit and spores, n.e.s., of"
"EGY",2013,7725,25739.918,2861748,"Kg","Electrical apparatus for switching "
"EGY",2013,6644,25549.041,5932926,"Area  SM","Float glass and surface ground or p"
"EGY",2013,7752,25472.552,NA,"N.Q.","Household-type refrigerators and fo"
"EGY",2013,2783,25401.55,956566454,"Kg","Sodium chloride, pure, & common sal"
"EGY",2013,572,25337.147,95053772,"Kg","Other citrus fruit, fresh or dried"
"EGY",2013,8921,25121.111,21605626,"Kg","Books, pamphlets, maps and globes, "
"EGY",2013,8731,24686.394,NA,"N.Q.","Gas, liquid or electricity supply o"
"EGY",2013,5534,24609.211,7556338,"Kg","Preparations for oral/dental hygien"
"EGY",2013,5813,24069.277,11579331,"Kg","Flexible tubes, pipes & hoses, havi"
"EGY",2013,6734,24039.366,122812601,"Kg","Flat-rolled products of iron or non"
"EGY",2013,741,23335.902,2176957,"Kg","Tea, whether or not flavoured"
"EGY",2013,6423,22891.522,11026254,"Kg","Registers, account-books, notebooks"
"EGY",2013,713,22717.491,3569954,"Kg","Extracts, essences and concentrates"
"EGY",2013,8131,22296.726,3793471,"Kg","Lamps and lighting fittings (includ"
"EGY",2013,6641,22076.44,55640018,"Kg","Glass in the mass, in balls, rods o"
"EGY",2013,6742,21686.118,24374598,"Kg","Flat-rolled products of iron or non"
"EGY",2013,7751,21310.72,NA,"N.Q.","Household-type laundry equipment, n"
"EGY",2013,6517,20991.577,4057588,"Kg","Artificial and man-made filament ya"
"EGY",2013,6516,20738.712,58758502,"Kg","Other synthetic filament yarn (othe"
"EGY",2013,6514,20595.655,4532951,"Kg","Sewing thread of man-made fibres, w"
"EGY",2013,6639,20213.468,17488185,"Kg","Articles of ceramic materials, n.e."
"EGY",2013,8139,19875.762,1555499,"Kg","Parts, n.e.s., of the goods of subg"
"EGY",2013,341,19707.658,18331156,"Kg","Fish, fresh (live or dead) or chill"
"EGY",2013,6781,19613.322,123170068,"Kg","Wire of iron or non-alloy steel"
"EGY",2013,5162,19467.559,14536452,"Kg","Aldehyde-, ketone- and quinone-func"
"EGY",2013,6975,19171.823,7774094,"Kg","Sanitary ware and parts thereof, n."
"EGY",2013,2786,18552.242,217519134,"Kg","Slag, dross, scalings and similar w"
"EGY",2013,5817,18317.914,7164916,"Kg","Fittings for tubes, pipes & hoses ("
"EGY",2013,5236,18147.565,182172479,"Kg","Phosphinates (hypophosphites), phos"
"EGY",2013,8438,18136.278,5561689,"Item","Underpants, briefs, nightshirts, py"
"EGY",2013,6595,17913.614,NA,"N.Q.","Carpets and other textile floor cov"
"EGY",2013,5911,17884.388,2689327,"Kg","Insecticides put up in forms/packin"
"EGY",2013,6518,17152.694,3978341,"Kg","Yarn (other than sewing thread) of "
"EGY",2013,19,16902.307,NA,"N.Q.","Live animals, n.e.s."
"EGY",2013,6768,16213.853,25249324,"Kg","Angles, shapes and sections (exclud"
"EGY",2013,6115,15860.532,1110691,"Kg","Sheep- or lambskin leather, without"
"EGY",2013,481,15793.691,28899181,"Kg","Cereal grains, worked or prepared i"
"EGY",2013,6412,15530.699,20884263,"Kg","Paper and paperboard, uncoated, of "
"EGY",2013,6579,15301.924,2837460,"Kg","Special products of textile materia"
"EGY",2013,2231,15112.349,7412968,"Kg","Copra"
"EGY",2013,5532,14977.76,3531194,"Kg","Beauty/make-up preparations for the"
"EGY",2013,5759,14786.68,9717647,"Kg","Plastics, n.e.s."
"EGY",2013,6416,14271.911,11587265,"Kg","Paper and paperboard, corrugated, c"
"EGY",2013,6532,14247.636,1636601,"Kg","Fabrics, woven, of synthetic staple"
"EGY",2013,8416,14134.034,NA,"N.Q.","Singlets and other vests, underpant"
"EGY",2013,221,14058.597,13863258,"Kg","Milk (including skimmed milk) and c"
"EGY",2013,8427,13805.665,685344,"Item","Blouses, shirts & shirt-blouses, wo"
"EGY",2013,6645,13788.204,NA,"N.Q.","Cast glass and rolled glass, in she"
"EGY",2013,8933,13728.469,12064087,"Kg","Floor coverings, wall or ceiling co"
"EGY",2013,8213,13672.16,5218965,"Kg","Furniture, n.e.s., of metal"
"EGY",2013,2225,13652.98,8884236,"Kg","Sesame (Sesamum) seeds"
"EGY",2013,2119,13613.98,1121603,"Kg","Hides and skins, n.e.s.; waste and "
"EGY",2013,6794,13560.436,36461925,"Kg","Other tubes, pipes and hollow profi"
"EGY",2013,2823,13178.248,37172280,"Kg","Other ferrous waste and scrap"
"EGY",2013,2919,13130.297,NA,"N.Q.","Materials of animal origin, n.e.s."
"EGY",2013,3222,13009.584,11167490,"Kg","Lignite, whether or not pulverized "
"EGY",2013,8428,12659.929,NA,"N.Q.","Singlets and other vests, slips, pe"
"EGY",2013,752,12612.358,6144688,"Kg","Spices (except pepper and pimento)"
"EGY",2013,7712,12409.146,NA,"N.Q.","Other electric power machinery; par"
"EGY",2013,5223,12039.309,37936174,"Kg","Inorganic acids and inorganic oxyge"
"EGY",2013,7781,12015.566,NA,"N.Q.","Batteries and electric accumulators"
"EGY",2013,8447,11957.5,1319407,"Item","Blouses, shirts & shirt-blouses, wo"
"EGY",2013,7478,11837.087,659480,"Kg","Taps, cocks, valves & similar appli"
"EGY",2013,2450,11780.587,73706241,"Kg","Fuel wood (excluding wood waste) an"
"EGY",2013,3354,11545.847,46462564,"Kg","Petroleum bitumen, petroleum coke a"
"EGY",2013,564,11134.3,51381542,"Kg","Flour, meal, flakes, granules and p"
"EGY",2013,5335,11052.619,13405778,"Kg","Colouring preparations of a kind us"
"EGY",2013,5238,10997.012,39959097,"Kg","Other metal salts and peroxysalts o"
"EGY",2013,222,10980.53,4402468,"Kg","Milk and cream, concentrated or swe"
"EGY",2013,7431,10792.073,NA,"N.Q.","Air or vacuum pumps, air or other g"
"EGY",2013,7711,10739.902,NA,"N.Q.","Transformers, electrical"
"EGY",2013,5311,10475.305,453187,"Kg","Synthetic organic colouring matter "
"EGY",2013,2234,9979.662,4995983,"Kg","Linseed"
"EGY",2013,2882,9945.381,7160019,"Kg","Other non-ferrous base metal waste "
"EGY",2013,8110,9528.136,NA,"N.Q.","Prefabricated buildings"
"EGY",2013,4222,9200.011,7244991,"Kg","Palm oil and its fractions"
"EGY",2013,611,9168.741,10658013,"Kg","Sugars, beet or cane, raw, in solid"
"EGY",2013,5989,9139.866,16177144,"Kg","Chemical products and preparations,"
"EGY",2013,573,9021.754,10224513,"Kg","Bananas (including plantains), fres"
"EGY",2013,981,8987.282,6332309,"Kg","Homogenized food preparations"
"EGY",2013,1110,8821.518,10257695,"Liter","Non-alcoholic beverages, n.e.s."
"EGY",2013,2651,8757.5,4975446,"Kg","Flax, raw or processed but not spun"
"EGY",2013,2667,8656.068,6608669,"Kg","Synthetic staple fibres, carded, co"
"EGY",2013,6359,8314.352,3949254,"Kg","Manufactured articles of wood, n.e."
"EGY",2013,6623,8306.894,21652527,"Kg","Refractory bricks and other refract"
"EGY",2013,8514,8231.513,261927,"Pair","Other footwear with uppers of leath"
"EGY",2013,6713,8071.899,312135945,"Kg","Granules and powders, of pig-iron, "
"EGY",2013,6512,8068.731,1259276,"Kg","Cotton sewing thread, whether or no"
